{
  "schemaVersion": 4,
  "toolchain": { "language": "go", "version": "1.26.6" },
  "extends": [],
  "defaults": {
    "includeFamilies": ["feature", "fix"],
    "excludeFamilies": ["scratch"]
  },
  "gates": [
    {
      "name": "full-local-build",
      "command": "go",
      "args": ["tool", "-modfile", "tools/go.mod", "quality-gate"],
      "timeout": "15m"
    }
  ]
}
